id,date,title,link,sujet,texte
50,23-07-15,Où sont les parents?,https://www.journaldemontreal.com/2023/07/15/ou-sont-les-parents,jeunesse,"On parle beaucoup de «la Grande Démission» depuis quelque temps. Ces millions de travailleurs qui ont décidé de quitter leur emploi parce qu’ils ne s’y sentaient plus «à leur place». Mais il y a une autre démission qui bouleverse nos sociétés, une démission tout aussi importante, dont on peut voir les impacts tous les jours dans les bulletins d’information. La démission des parents. LA GRANDE LICORNE On s’est tous posé la question en voyant des centaines de jeunes délinquants foutre le bordel dans les rues de Paris. Coudonc, ils sont où, les parents de ces voyous? Ils font quoi? Même réaction face à la montée de la délinquance à Montréal. Ils n’ont pas de parents, ces jeunes-là? Certes, tout comme les enfants ne sont pas responsables des crimes commis par leurs parents, les parents ne sont pas responsables des crimes commis par leurs enfants. Reste qu’on a de plus en plus l’impression que des parents ont tout simplement abdiqué leurs responsabilités. Ils ont baissé les bras et se sont dit: «Bof, advienne que pourra... C’est trop dur d’élever des enfants, les profs feront la job à ma place, après tout, ils sont payés pour faire ça...» Vous souvenez-vous de Sébastien Vachon, cet entrepreneur de Québec qui s’était costumé en licorne pour rappeler à ses employés que le travail n’était pas qu’un jardin de roses? Que c’était bien beau de demander de bonnes conditions de travail, mais qu’il fallait aussi y mettre du sien? Faire un effort? Bref... travailler? Eh bien, Sébastien Vachon devrait tenir le même discours aux parents du Québec. «C’est bien beau les bisous, les câlins et les jeux, mais être parent, c’est pas animer un camp de vacances. C’est exigeant, difficile. Faut que tu dises non à ton enfant, que tu lui mettes des balises, des limites, que tu le confrontes... Si tu n’es pas prêt à faire ça, eh bien, ne fais pas d’enfant et achète-toi un chat.» PETULA CLARK AVAIT RAISON C’est bien beau être l’ami de ton enfant, mais ton enfant n’a pas besoin d’amis, il en a plein. Il a besoin de parents. C’est-à-dire d’une figure d’autorité. Hon, le vilain mot! Hon, le mot tabou! L’autorité, c’est le patriarcat, le pouvoir, la domination, l’asservissement, l’exploitation, blablabla... Non. L’autorité, c’est de l’amour qui se tient debout. Laisser ton enfant agir comme bon lui semble, lui dire toujours oui, répondre à ses moindres désirs, c’est la pire chose que tu peux faire à ton enfant. Le respect, ça commence à la maison. C’est ça, le rôle d’une famille: prendre un être hyper dépendant qui se chie dessus et n’est pas capable de se débrouiller tout seul et en faire un citoyen honnête. C’est une job à temps plein. Il ne suffit pas de porter une salopette orange, de se mettre à quatre pattes et de se faire appeler Balou. C’est dur. C’est probablement la job la plus dure au monde. «Tout le monde veut aller au ciel mais personne ne veut mourir», chantait Petula Clark. On veut seulement les bons côtés de la vie, jamais les mauvais. Eh bien désolé, mais travailler, c’est de la job. Ce n’est pas toujours une partie de plaisir. Parfois, c’est plate. Il y a des règles, des balises, un cadre. Idem pour élever un enfant. Tu veux juste avoir du fun avec ton enfant? Tu vas te retrouver avec les Champs-Élysées en feu et des fusillades sur la rue Sainte-Catherine."
51,23-07-17,Ces «malades» qui ne veulent pas porter le voile,https://www.journaldemontreal.com/2023/07/17/ces-malades-qui-ne-veulent-pas-porter-le-voile,islam,"Décidément, la science ne cesse de faire des progrès... Savez-vous ce qu’ont découvert les autorités iraniennes, ces derniers jours? Que les femmes qui veulent cesser de porter le voile islamiste sont atteintes d’une grave maladie mentale. Et que cette maladie est contagieuse. Eh oui, on peut «attraper» une maladie mentale comme on attrape la grippe! Ça, ça s’appelle la «science islamiste». Deux mots qui se contredisent. Comme «cigarettes légères». Ou «discrimination positive». UNE MALADIE MYSTÉRIEUSE Il y a quelques jours, une Iranienne qui refusait de porter le voile islamiste a été condamnée à six mois de prison et à 300 h de travaux communautaires. On lui interdit de voyager hors du pays pendant deux ans, et elle devra suivre une thérapie (à raison de deux rencontres par semaines pendant six mois) afin de «guérir ses graves troubles de santé mentale». Selon la Cour de Téhéran, une «pandémie mystérieuse» frappe de plus en plus de femmes en Iran. Cette maladie les pousse à enlever leur voile et à «multiplier les relations sexuelles» qui contreviennent à la bienséance, encouragent la débauche et menacent la paix sociale. Bref, en Iran, si tu ne portes pas le voile, tu es une nymphomane, une folle. Qui mérite d’être envoyée de force en «quarantaine» pour être «soignée» et «rééduquée». Et pendant ce temps, certains disent que La Servante écarlate, la fameuse dystopie de la Canadienne Margaret Atwood, est une métaphore de l’Amérique. Euh... Allô? En passant, selon le site IranWire, la fameuse thérapie obligatoire destinée à «soigner» les pauvres Iraniennes souffrant de cette «étrange maladie mentale» n’est pas remboursée par le gouvernement. Elle doit être payée par les «malades» elles-mêmes. À raison de 520$ par rencontre. EFFAÇONS LES FEMMES! Et pendant ce temps, en Occident, nos «défenseurs des droits et libertés» font la promotion du voile islamiste et du burkini! C’est le monde à l’envers... Imaginez si des pays obligeaient les Noirs ou les gais à porter un vêtement distinctif, qui affirme haut et fort leur statut d’infériorité. Et que les autorités de ces pays envoyaient en prison tous ceux qui refusent de porter ce vêtement. Pensez-vous que nos boutiques vendraient ces vêtements? Et que nos gouvernements seraient tout fiers de montrer des gais et des Noirs portant avec bonheur ce vêtement dans leurs publications officielles? Jamais dans 100 ans! Mais ce sont des femmes qui sont obligées de porter ce voile. Alors on trouve ça cool. C’est ça, aussi, le recul des femmes. Banaliser un vêtement qui n’a qu’un seul et unique but: clamer que les femmes ont un statut social inférieur et que leur sexualité est dangereuse. Mais tout cela n’est pas surprenant. Car même en Occident, on est en train d’effacer les femmes. Tout le monde peut être une femme, maintenant. Il suffit de le «vouloir». Pourquoi se contenter de voiler une femme quand tu peux la remplacer par un homme déguisé en femme? Ou un homme qui se dit femme? Même le mot «femme» est rendu «discriminatoire». On dit «personne possédant un utérus». On n’arrête pas le progrès, vous dis-je..."
52,23-07-18,«Hair» et les utopies dangereuses,https://www.journaldemontreal.com/2023/07/18/hair-et-les-utopies-dangereuses,gauche,"Pour toutes sortes de raisons qu’il serait trop long d’expliquer ici, je n’ai pas pu assister à la première de la comédie musicale Hair, qui est présentée au St-Denis à Montréal dans une mise en scène de Serge Denoncourt. Alors j’y suis allé il y a quelques jours. Pour être franc avec vous, j’étais sûr que j’allais détester ça. Or, j’ai adoré. C’est l’un de mes coups de cœur de l’année. Mononcle était debout et dansait presque dans l’allée. UN SPECTACLE ÉBOURIFFANT! Pourquoi j’y allais de reculons? Parce qu’il n’y a rien de pire que des reconstitutions de l’ère hippie. Ça ressemble toujours à un party d’Halloween, avec du monde costumé. Comme un épisode de la série Harmonium. Avec des bandeaux trop propres et des perruques cheaps. Même le magnifique film de Milos Forman ressemblait parfois à une soirée «Retour aux années 60 avec le Psychedelic Wonder Band». Or, je ne sais par quel miracle, mais là, on y croit. Serge Denoncourt, le costumier Pierre-Guy Lapointe et le décorateur Guillaume Lord ont évité avec intelligence tous les pièges d’une telle reconstitution. Et puis il y a les comédiens/chanteurs/danseurs. J’ai rarement vu une troupe aussi généreuse, aussi talentueuse. C’était deux semaines après la première, et ils se défonçaient comme s’ils jouaient leur carrière et passaient une audition. Leur énergie est contagieuse, comme s’ils nous injectaient de la dopamine dans le derrière. Ces jeunes-là seraient capables de faire danser des paralytiques, comme le frère André! Si ça continue, le St-Denis va recouvrir ses murs de béquilles qui ne servent plus, comme l’Oratoire! Bref, chapeau, monsieur Denoncourt. Hair est bel et bien décoiffant. DES LENDEMAINS QUI DÉCHANTENT Mais, bon, je ne suis pas là pour faire une critique. Je veux juste vous parler d’un petit détail, qui est probablement passé inaperçu pour beaucoup de spectateurs présents dans la salle, mais que j’ai trouvé malin, intelligent. Un moment donné, un des hippies distribue des châles et des ponchos à ses amis pour qu’ils se couvrent les épaules et se réchauffent. Et parmi ces couvertures, il y a... un drapeau de l’URSS. Avec la faucille et le marteau. J’ignore si ce détail faisait partie du spectacle original en 1967. Quelque chose me dit que c’est Denoncourt qui l’a rajouté. Je fais peut-être de la surinterprétation, je vois peut-être un missile ou un phallus là où il n’y a qu’un cigare, mais c’est comme si Denoncourt disait: «C’est bien beau, vouloir changer le monde, les amis, mais faites attention: souvent, les promesses de paradis mènent tout droit en enfer». En 1917, les Soviets voulaient changer le monde. Ça a donné l’archipel du goulag. En 1789, les Français voulaient révolutionner le monde: ça a donné la guillotine et la Terreur. Que de sang a été versé par les chantres de l’humanisme! Vive les utopies, semble nous dire Denoncourt. Mais n’oublions pas que même les révolutions les mieux intentionnées ont fini par accoucher de tyrannies. Et que si le Peace and Love était la face lumineuse des années 60, Charles Manson en constituait sa face sombre. "
53,23-07-19,Le capitalisme hippie à l’assaut des gouvernements,https://www.journaldemontreal.com/2023/07/19/le-capitalisme-hippie-a-lassaut-des-gouvernements,capitalisme,"Hier, je vous parlais des hippies et de la comédie musicale Hair**.** «Let the Sunshine in», chantaient les hippies des années 60. Faites l’amour, pas la guerre! Or, vous ne le savez peut-être pas, mais contrairement aux punks, qui sont en voie de disparition, les hippies sont toujours présents dans nos sociétés. Ils sont même plus puissants que jamais. Sauf que ce n’est plus le soleil qu’ils veulent laisser entrer, mais le fric. Et ce n’est plus l’establishment bourgeois qu’ils attaquent, mais les gouvernements, les nations. LES NOUVEAUX MONSTRES Mon ami Michel Trudeau est un grand dévoreur d’essais. Et lors d’un BBQ, il y a quelques jours, il m’a parlé d’un livre très intéressant sur la création de Netflix: No Rules Rules, de Reed Hastings. Hastings, qui a cofondé Netflix en 1998, y explique les raisons du succès de son entreprise. Un, ils paient très bien leurs employés. Deux, ils leur permettent de prendre autant de journées de congé qu’ils le désirent, en autant qu’ils atteignent leurs objectifs, etc. Mais toute la culture d’entreprise de Netflix est résumée dans le titre du livre: No Rules Rules. La règle, c’est qu’il n’y a pas de règles. Comme Michel Trudeau me disait: vous vous souvenez du slogan «Il est interdit d’interdire» que les manifestants de mai 68 scandaient dans la rue? Eh bien, c’est devenu la devise des géants du web comme Facebook, Google, Amazon, Apple et Netflix. Il est interdit de nous interdire de faire ce qu’on veut où on veut. C’est la mentalité hippie appliquée à l’ère de l’ultra-capitalisme. Dans les années 60, les hippies se révoltaient contre «The Man» – c’est-à-dire les bourgeois, les puissants. Eh bien, en 2023, l’institution à abattre, le nouvel ennemi numéro Un de la liberté, c’est le gouvernement. On assiste, en Chine, à la montée d’un modèle inédit de Société: le capitalisme d’État. Le capitalisme communiste. On n’avait jamais pu imaginer pareille bête. C’est comme un ornithorynque, une chimère. Une tête de communiste sur un corps de capitaliste. En Occident, on assiste à la naissance d’un autre monstre, tout aussi capoté. L’anarcho capitalisme. Une tête de hippie sur un corps de Yuppie. Les cheveux longs et les pieds nus avec un complet trois pièces et des bretelles. Mi-hippie, mi-magnat. Un croisement entre Rockefeller et George Harrison. Chantant My Sweet Lord en comptant ses milliards. LES TROIS MOUSQUETAIRES Les géants du web, c’est ça: des hippies qui ne veulent plus rien savoir des règles imposées par les gouvernements et les nations, et qui considèrent les frontières comme des clôtures à enjamber. Leur seule devise: LIBAAAAAARTÉ! Comme les zozos qui ont pris d’assaut le Capitole américain et le centre-ville d’Ottawa. Libertariens, hippies, anarchistes: ce sont les Trois mousquetaires du 21e siècle. Ils ne sont ni de droite ni de gauche. Ils sont juste contre toute contrainte, toute loi. Laissez les individus faire ce qu’ils veulent. Et les entreprises agir comme elles l’entendent. Face à cette tornade, à cet ouragan, les nations tentent tant bien que mal de résister. Mais il vente fort. Pas sûr qu’elles vont tenir. "
54,23-07-20,Trudeau a besoin d’un chien Mira et d’une canne blanche,https://www.journaldemontreal.com/2023/07/20/trudeau-a-besoin-dun-chien-mira-et-dune-canne-blanche,islam,"«Il n’y a pas de pires aveugles que ceux qui ne veulent pas voir», dit l’adage. Ces gens-là peuvent voir. Ils ne souffrent d’aucune maladie et ont des yeux en excellente santé. Mais quand la réalité contredit leurs croyances, quand certains faits vont à l’encontre de leur idéologie, pouf, ils deviennent soudainement aveugles et ne voient plus rien. «Hein? Quoi? Des immigrants racisés qui militent contre l’avortement et les droits des gais? Ça ne se peut pas, voyons! C’est impossible! Seuls les Blancs épousent de telles opinions!» UNE FAKE NEWS**!** Comme Joseph Facal l’a écrit le 11 juillet, de plus en plus de groupes musulmans militent ouvertement contre les droits des LGBTQ+. Ils ne veulent pas qu’on parle d’homosexualité à l’école et trouvent que les cours d’éducation sexuelle sont des outils de propagande, pour ne pas dire de recrutement. «Laissez nos enfants tranquilles!» disent-ils en piétinant le drapeau arc-en-ciel devant les caméras. Ce genre d’événements se multiplient. Tant aux États-Unis qu’au Canada. Récemment, au Stampede de Calgary, on a même pu voir un député du Parti conservateur du Canada se faire photographier aux côtés de militants musulmans anti-gais qui portaient fièrement leur t-shirt «Leave Our Kids Alone!» Et comme le rapportait le National Post hier, un des hommes sur la photo était Mahmoud Mourra – qui, le mois dernier, à Calgary, a organisé une manifestation contre «l’endoctrinement homosexuel LGBTQ» dans les écoles canadiennes! Mais savez-vous quoi? Cela n’existe pas! Le mouvement musulman contre les droits des minorités sexuelles est une invention de l’extrême droite! Ce n’est pas vrai que des musulmans militent contre les gais et les trans! C’est un complot, une fake news inventée de toutes pièces par l’extrême droite américaine! C’est ce qu’a dit Justin Trudeau dans une mosquée de Calgary la semaine dernière... «Ce supposé mouvement est nourri par des gens qui ont toujours lutté contre les droits des musulmans et la communauté musulmane», a-t-il dit. Bref, tu dis que des musulmans militent contre les droits des gais? Tu es raciste! Islamophobe! Tu fomentes la haine et souffles sur les braises de l’intolérance! LES MINORITÉS ONT TOUJOURS RAISON Des catholiques militent contre les gais? C’est vrai! Des musulmans militent contre les gais? C’est faux! Car les musulmans font partie d’une minorité! Et les minorités se tiennent entre elles! Aucun Noir n’est raciste! Aucune femme n’est contre l’avortement! Aucun musulman n’est contre les gais! Aucun Mexicain n’appuie Trump! Aucun gai ne vote pour Duhaime ou Poilievre! C’est impossible! Les minorités sont toujours du bon bord! Elles sont la vertu incarnée! Elles défendent toutes des valeurs progressistes! Elles sont comme l’aiguille d’une boussole, elles indiquent toujours la bonne direction à prendre! Un Blanc catho qui milite contre les gais est un salaud! Un Arabe musulman qui milite contre les gais est un homme perdu et confus qui est instrumentalisé par... des Blancs cathos! Tout est de la faute des Blancs cathos! Surtout s’ils sont hétérosexuels, pouah! Justin Trudeau mérite une place spéciale dans les encyclopédies. En effet, c’est la première fois dans l’Histoire du Canada qu’un sourd et aveugle dirige les destinées du pays..."
55,23-07-22,Les hommes sont tous des violeurs?,https://www.journaldemontreal.com/2023/07/22/les-hommes-sont-tous-des-violeurs,patriarcat,"Je ne sais pas vous, mais moi, dès qu’un livre qui critique le wokisme sort, je m’empresse de l’acheter. Surtout s’il est drôle. Quand j’ai su que l’écrivain français Frédéric Beigbeder venait de publier un essai sur les relations hommes-femmes à l’époque de #MeToo, je me suis rué vers la librairie la plus proche. Pour voir ce qu’il avait à dire sur l’ennemi public numéro un des petits lapins: le mâle hétérosexuel de plus de 50 ans. Aussi connu sous le nom de «mononcle». Jeter le bébé avec l’eau du bain Pour ceux qui ne connaissent pas Beigbeder, disons que c’est un joyeux fêtard. En fait, C’ÉTAIT un joyeux fêtard, car maintenant, le Casanova du 6e arrondissement a quitté Paris pour s’installer à la campagne et regarder ses carottes pousser. Mais avant, l’homme s’envoyait en l’air avec tout ce qui portait jupon. Il buvait, sniffait, cruisait et couchait. Dans l’ordre et le désordre. Surtout si la fille avait entre 18 et 25 ans. Dans son dernier livre, Confessions d’un hétérosexuel légèrement dépassé, l’auteur du roman culte 99 Francs déplore le fait que dans le domaine des relations homme-femme, on ait jeté le bébé avec l’eau du bain. Bien sûr qu’il faut combattre les prédateurs! Bien sûr qu’il faut dénoncer les mononcles aux mains baladeuses, ça tombe sous le sens! Mais faut-il aller jusqu’à transformer la séduction en délit? Et confondre «drague lourde» et «agression sexuelle»? La première partie du livre de Beigbeder m’a fait sourire. J’ai trouvé sa charge contre le puritanisme ambiant rafraîchissante. Mais la seconde m’a fait grincer des dents. Je le lisais, et me disais: «Avec des amis comme Frédéric Beigbeder, les mâles hétérosexuels n’ont pas besoin d’ennemis! Le gars nous fait tous passer pour des violeurs en puissance.» Tous des chacals? Voici quelques extraits du livre: «Ne croyez pas que les hétérosexuels pensent à autre chose qu’au sexe; on fait juste semblant. Si je réalisais mon désir, je serais tout le temps tout nu dans la rue en train de me frotter sur des inconnues comme un caniche.» «On est tous des chacals. Le chacal ne lâche jamais sa proie avant de l’avoir mangée. Le chacal a tout le temps faim. Le chacal attend toute la nuit s’il le faut.» «L’homme est une machine à baiser. Un criminel potentiel. [...] S’il n’y avait rien pour nous limiter, on se ferait sucer toute la journée par des femmes. [...] Quand on ne vous touche pas, c’est uniquement parce que la loi l’interdit.» «C’est la peur de la prison qui empêche les hommes d’agresser sexuellement toutes les femmes qui leur plaisent. C’est un miracle quotidien que tant de femmes ne soient pas victimes d’agression sexuelle.» Euh... Vraiment? Je suis un hétérosexuel en bon état de marche qui a encore de la mine dans le crayon malgré ses cheveux gris. Et je ne crois pas que c’est la peur de la prison qui m’empêche de violer toutes les femmes que je croise. Et de «grainer» dans les bars. L’être humain est un animal, mais certains sont plus bêtes que d’autres, faut croire... "
56,23-07-24,Vive les foufounes du Canada!,https://www.journaldemontreal.com/2023/07/24/vive-les-foufounes-du-canada,patriarcat,"Ainsi, MindGeek, la maison mère de Pornhub, ne veut pas être soumise à la nouvelle loi sur la radiodiffusion canadienne, qui l’obligerait, comme tout autre diffuseur du pays, à respecter un quota de contenu canadien. L’industrie de la porno, disent les patrons de l’entreprise de Montréal, ne devrait pas être obligée de faire la promotion de la culture canadienne. Car lorsqu’on parle de «culture», on ne pense pas nécessairement à ce qu’on trouve sur Pornhub. Les trois premières lettres du mot, oui. Mais pas celles qui suivent. Un pays érotique! Désolé, les amis, mais au risque de faire bande à part, je me dresse, je hisse mon drapeau, je m’érige de toutes mes forces contre cette position mollassonne! Car lorsque je regarde des films cochons, mesdames et messieurs, je veux voir des cuisses canadiennes! Des foufounes de Moose Jaw! Des tétons de Flin Flon! Des pubis de Big Beaver, fier hameau de la Saskatchewan! Des femmes fontaines qui me rappellent les chutes du Niagara! Des sex toys évoquant les magnifiques paysages de Dildo, à Terre-Neuve! Des érections dignes des plus beaux totems de Kitwanga, en Colombie-Britannique! Des auréoles boréales! Des glands ramassés à Cap-Tourmente! Après tout, nous sommes au Canada! Pays de naissance de PET, où l’on trouve les villes de Balls Creek (Nouvelle-Écosse), Crotch Lake (Ontario), Ball’s Falls (Ontario), Saint-Louis-du-Ha! Ha! (Québec), Climax (Saskatchewan), Urin (Saskatchewan) et Finger (Manitoba)! Sans oublier l’Île aux fesses, près de Drummondville! Blow Me Down à Terre-Neuve! Et Tiny, en Ontario! Des institutions! La porno ne fait pas partie de la culture de notre beau grand pays? Voyons! C’est au cœur de notre culture! Qu’est-ce que ça prend pour faire un village, au Québec? Quatre choses: une Caisse Pop, une pharmacie Jean Coutu, une église et un bar de danseuses! Vous avez réuni ces quatre institutions? Vous avez une municipalité! Que serait notre belle province sans La Broussaille à Québec? L’Extase à Saint-Romuald? Le Valentine à Victoriaville? Le Crazy Moon à Laval? Ou la défunte Calèche du sexe à Montréal? Sans oublier tous les restos qui s’appellent Le Vieux Four? Je m’excuse, mais tout comme il serait inconséquent de faire construire des wagons de REM en Inde, ou d’importer de l’électricité du Maine, il serait stupide de consommer de la porno produite à l’étranger alors que le Québec regorge de ressources naturelles! J’ai déjà demandé à Anne-Marie Losique, qui est présidente d’une chaîne de télé spécialisée dans le divertissement pour adultes (et qui, pour être compétitive, doit se maintenir au fait des nouveaux courants), quelle était la grosse mode dans le domaine. Sa réponse: les «Yummy Grannies», la porno mettant en scène des personnes âgées! Et quel État est rempli à ras bord de vieux? Le Québec! Bref, du talent, on en a! Ça, ça serait une bonne façon de garder nos aînés actifs! Monsieur Legault, à quand un panier bleu XXX qui met de l’avant notre expertise locale? Après tout, comme le chantait Charlebois, au Québec, tout commence par un Q et finit par un bec."
