id,date,title,link,sujet,texte
71,23-08-14,Le vampire des médias,https://www.journaldemontreal.com/2023/08/14/le-vampire-des-medias,capitalisme,"«Chef! Chef! — Quoi? — Le vampire des médias a encore frappé! — C’est quoi, cette fois? — Un quotidien gratuit de la région de Montréal... — Même modus operandi? — Oui. Les mains ligotées dans le dos, un sac de plastique sur la tête et complètement vidé de ses revenus publicitaires... — Et le vampire a laissé une lettre? — Toujours la même. “Je frapperai de nouveau bientôt. Et vous ne pouvez rien faire pour m’arrêter”... — Le salaud!» Un autre mord la poussière J’utilise un ton satirique, mais c’est loin d’être drôle. «Another One Bites the Dust», comme chantait Queen. Partout à travers le monde, les médias traditionnels tirent le diable par la queue. Surtout les journaux. Avez-vous déjà vu un jeune devant un journal papier? Il est aussi dépourvu que devant un téléphone à roulette, il se demande comment passer au texte suivant, il frotte son index contre le bas de la page, mais rien ne se passe... Ajoutez à cela le coût du papier, la hausse du prix de l’essence et la pénurie de camelots (qui veut encore se lever à 5 h du matin pour livrer un journal?), et vous avez un système de distribution déficient. Résultat: de plus en plus d’éditeurs prennent le virage numérique. Or, pour vivre, un journal doit vendre de la pub. (Un journal, ce sont des mots imprimés entre deux publicités. Un journal vend des textes à ses lecteurs, et des lecteurs à ses annonceurs. C’est la grande chaîne des médias. Hakuna Matata.) Le hic est que les géants numériques ont tellement d’argent qu’ils peuvent vendre leurs pubs à des coûts très bas, qu’aucun journal traditionnel ne peut concurrencer. Résultat: les Facebook et les Google de ce monde aspirent tout l’air disponible dans l’écosystème médiatique, et les journaux frétillent sur le sol comme des poissons rouges tombés hors de leur aquarium (ou comme Éric Lapointe dans un salon de thé.) Certains médias s’en tirent mieux que d’autres grâce à des lecteurs très fidèles et à du contenu à valeur ajoutée, comme celui que vous lisez ce matin, mais plusieurs sont sur le bord de la faillite. Une industrie asphyxiée Vous me direz que les temps sont durs pour tout le monde, et qu’un journaliste qui perd sa job ne fait pas plus pitié qu’un commis qui perd la sienne. Vous avez raison. Reste qu’on parle ici d’une industrie au grand complet qui est en train de suffoquer, étranglée par le «vampire des médias» qu’est Facebook. Une entreprise dont le rôle est de poser des questions aux gens en autorité. Je ne veux pas sortir le mot en D («Démocratie»), mais reste que moins il y a de médias, dans une Société, moins il y a de pluralité de voix, et plus cette Société va mal. Et quand je parle de médias, je ne parle pas de BIGBOOBS-AND-CONSPIRACIES.COM. Il n’y a pas 36 solutions. Soit on met Facebook au pas. Soit le gouvernement vient en aide aux médias. Vous pouvez aussi faire votre part en vous abonnant à votre média préféré et en utilisant son application pour lire ce qu’il a à vous dire."
72,23-08-15,Le drôle de calcul de notre drôle de ministre de l’Immigration,https://www.journaldemontreal.com/2023/08/15/le-drole-de-calcul-du-ministre-de-limmigration,immigration,"Vous ne le savez peut-être pas, mais il y a un génie au sein du gouvernement Trudeau, un homme qui ferait passer Albert Einstein pour l’auteur des blagues qu’on trouvait dans les paquets de gommes Bazooka. Je parle bien sûr de Marc Miller, le nouveau ministre de l’Immigration. La solution magique! Quand on lui a demandé s’il n’avait pas peur que l’arrivée massive d’immigrants planifiée par son gouvernement aggrave la crise du logement, monsieur Miller a répondu: «Au contraire, ça va stopper la crise, car les nouveaux arrivants vont construire des maisons!» Pas mal, non? Avouez: vous n’y avez jamais pensé! Je sais ce que vous allez me dire: mais les enfants de ces immigrants, qui va leur enseigner? On manque déjà de profs! Eh bien, c’est simple: tout comme les immigrants vont régler la crise du logement, ils vont régler la crise causée par la pénurie de profs, car en plus de bâtir des maisons, ils vont enseigner!!! Ils vont devenir maçons ET profs! Je vous entends dire: et le système de santé? Qui va soigner ces millions de nouveaux arrivants quand ils vont tomber malades? Mais... les immigrants, voyons! Car ils vont bâtir des maisons, devenir profs ET faire des études en médecine! Et qui va les nourrir? demandent les plus sceptiques d’entre vous. Mais... les immigrants! Car ils vont AUSSI devenir agriculteurs! Et éleveurs! Ils vont construire des maisons, enseigner aux enfants, soigner les malades, élever des poules et des bœufs, et faire pousser des fruits et légumes! Et le système de justice? Il y a présentement un manque criant de policiers, de procureurs, d’interprètes, de constables spéciaux, d’agents correctionnels et de greffiers... La crise est telle qu’il faut abandonner des enquêtes, faire avorter des procès et remettre de dangereux criminels en liberté... L’arrivée de tous ces immigrants ne risque-t-elle pas de faire péter le système, qui tient déjà avec de la broche? Non, car ces immigrants vont devenir policiers, procureurs, interprètes, constables spéciaux, agents correctionnels ET greffiers! En plus de construire des maisons, d’enseigner, de soigner les malades et tutti quanti! C’est ça, la doctrine Miller! C’est magique! Les immigrants vont régler tous les problèmes qui accablent présentement le pays! Ouvrons les vannes! En fait, quand on y pense, ce ne sont pas un demi-million d’immigrants qu’on devrait accepter chaque année. C’est 10 millions! Vous imaginez le nombre de maisons qui lèveraient de terre avec un tel seuil? Ça serait hallucinant! Ça pousserait comme des champignons sur les murs de nos écoles! On se retrouverait avec un nombre record de médecins, de policiers et de profs! C’est à se demander pourquoi personne n’y a pensé avant... Heureusement, Marc Miller est là! Vendredi dernier, dans sa chronique, Joseph Facal disait que le lobby immigrationniste est ignorant ou menteur. Mais non, Joseph, voyons! Ces gens sont des génies! Ils réinventent la démographie! Pour eux, un immigrant qui arrive n’est pas un locataire de plus. C’est un constructeur de maisons de plus! De même, ce n’est pas un patient de plus. C’est un médecin de plus! Tu n’as rien compris! "
73,23-08-16,Le Québec souffre d’Alzheimer,https://www.journaldemontreal.com/2023/08/16/le-quebec-souffre-dalzheimer,identité,"Je suis à Paris depuis quelques semaines. Chaque fois que je vais là-bas, ça me frappe: le passé, en France, n’est pas passé. Il est présent. Il fait partie de la vie de tous les jours. Il se rappelle aux passants à tous les coins de rue. L’Histoire, en France, n’est pas cachée dans le fond d’un tiroir ou emprisonnée à perpétuité dans un musée. Elle est vivante. Elle respire. D’HIER À DEMAIN Chaque fois que je vais à Paris, je descends au même hôtel. Qu’est-ce qui est inscrit sur une plaque apposée sur la façade de cet hôtel? «Félix Leclerc (1914-1988) séjourna ici en 1951. Il donna ses lettres de noblesse à la chanson francophone.» Il faut dire que des plaques commémoratives, il y en a à tous les 20 mètres, à Paris. «Ici, Molière est mort le 17 février 1673, après une représentation du Malade imaginaire.» «Ici a habité Marguerite Duras.» «Ici, Voltaire s’est gratté le schtroumpif après avoir bu une bière...» Il y a tellement de plaques du genre qu’un magasin de souvenirs vend une plaque humoristique disant: «Ici, le 22 mars 1765, rien d’intéressant ne s’est déroulé...» Mais quand je parle de la présence du passé, je ne parle pas que de l’Histoire avec un grand H. Je parle aussi de la culture. Avec un grand et un petit C. C’est ainsi que j’ai pu montrer à mon fils de 15 ans plusieurs classiques du cinéma, en version restaurée: Clockwork Orange et The Shining, de Stanley Kubrick, Dog Day Afternoon, de Sidney Lumet avec Al Pacino, Le Fabuleux destin d’Amélie Poulain, les premiers films de Christopher Nolan (qu’il a voulu voir après avoir été «pulvérisé» par Oppenheimer)... Et j’ai pu revoir des classiques italiens, suédois et allemands sur grand écran. Pas à la Cinémathèque française, non. Dans des salles de cinéma modernes, avec un gros écran et de gros fauteuils confortables. Et pour entrer, il fallait faire la queue, car il y avait plein de jeunes qui voulaient acheter un billet! Car, oui, là-bas, le passé n’intéresse pas que les gens aux cheveux blancs... AUCUNE MÉMOIRE Et pendant ce temps, au Québec, on se demande s’il ne faudrait pas faire lire des classiques de la littérature aux jeunes... Comme si la question se posait! En octobre 2022, ma blonde Sophie a reçu le ministre de la Culture Mathieu Lacombe à QUB radio. Elle lui a demandé quel grand metteur en scène québécois venait tout juste de mourir... Voyant que le ministre ne connaissait pas la réponse, elle lui a donné un indice: «Il a mis en scène les plus grandes pièces de Michel Tremblay, dont Les Belles-Sœurs.» Toujours pas de réponse. «André Brassard», lui a soufflé Sophie. Le ministre n’avait visiblement jamais entendu ce nom. «C’est une question de génération», a répondu le ministre de la Culture pour expliquer son ignorance. Ah, bon. C’est drôle, moi, je sais qui est Émile Nelligan, même s’il est mort 20 ans avant ma naissance. C’est ça, la mémoire du Québec. Trente ans max. Après, c’est bon pour les vidanges. Ou le bulldozer. "
74,23-08-17,Poursuivons nos gouvernements!,https://www.journaldemontreal.com/2023/08/17/poursuivons-nos-gouvernements,état,"Vous avez vu ce qui s’est passé au Montana? Une loi interdisait à l’administration locale de prendre en compte les conséquences des émissions de gaz à effet de serre sur le climat lors de l’attribution de permis à des entreprises d’énergies fossiles. Seize jeunes âgés de 5 à 22 ans ont poursuivi l’État du Montana en disant que cette loi était inconstitutionnelle, car elle niait leur droit à vivre dans un «environnement propre et sain». Une juge leur a donné raison. LE DROIT À UNE ÉDUCATION RIGOUREUSE La décision de cette juge pourrait avoir des conséquences importantes sur de futurs dossiers, dit-on. Déjà, d’autres poursuites du genre se préparent un peu partout aux États-Unis. D’autres groupes de jeunes vont tenter de faire invalider des lois qu’ils jugent trop complaisantes envers les industries polluantes, sous prétexte que ces lois briment leurs droits fondamentaux garantis par la Constitution. Une idée, comme ça... Et si les jeunes du Québec s’inspiraient de ce combat pour protéger leur droit à recevoir une bonne éducation? Imaginez... «Vous ne cessez de baisser la barre, vous ne nous faites plus lire de classiques, vous refusez d’interdire le cellulaire en classe et vous avez remplacé des méthodes d’enseignement rigoureuses qui avaient fait leurs preuves pendant des décennies par des méthodes à gogo qui ont évacué toute notion de rigueur et d’effort.» «Nous jugeons qu’en agissant de la sorte, vous avez brimé nos droits constitutionnels à recevoir un enseignement de qualité capable de nous aider à nous débrouiller dans un monde de plus en plus complexe.» On peut rêver, non? Après tout, recevoir une éducation de qualité est aussi important que de grandir dans un environnement sain! «Un esprit sain dans un corps sain», comme dit l’adage! À LA BARRE DES TÉMOINS! Non mais, tant qu’à poursuivre, poursuivons! Poursuivons nos gouvernements pour leur complaisance envers les religions qui briment les droits fondamentaux des femmes, des enfants et des minorités sexuelles! Poursuivons nos gouvernements pour ne pas avoir écouté nos démographes qui, depuis des décennies, nous mettent en garde contre les dangers causés par le vieillissement de la population! Vous saviez qu’on allait avoir besoin de plus de médecins, de préposés et d’infirmiers, et vous n’avez rien fait! Poursuivons nos gouvernements pour avoir dépensé sans bon sens, sur le dos des futures générations! Poursuivons nos gouvernements pour ne pas avoir pris les moyens nécessaires pour mieux protéger le français! L’anglicisation de Montréal n’est pas arrivée du jour au lendemain, elle est le résultat de décennies de laisser-faire! Poursuivons nos gouvernements pour avoir laissé toutes sortes de théories bidon dénuées de tout fondement scientifique proliférer dans nos universités et nos institutions culturelles! Poursuivons nos gouvernements pour s’être montrés trop complaisants pendant trop longtemps envers les géants numériques, mettant ainsi en danger la survie de notre culture et même de notre démocratie! Etc., etc. Tant qu’à avoir un gouvernement de juges, allons-y jusqu’au bout! Traînons nos parlements en cour! Demandons-leur des comptes! Obligeons nos politiciens à répondre de leurs actes! Après «Aux armes, citoyens!», crions «À la Constitution! À la charte des droits!»"
75,23-08-19,"Québécois, ressortons nos raquettes et notre ceinture fléchée!",https://www.journaldemontreal.com/2023/08/19/quebecois-ressortons-nos-raquettes-et-notre-ceinture-flechee,identité,"Une question me turlupine depuis un certain temps. Par quelle bizarrerie de l’Histoire les Québécois sont passés de pauvre minorité que l’on doit protéger à méchante majorité qu’on ne se gêne pas d’insulter? Quand s’est effectué ce passage? Un jour, les francophones du Québec étaient les pauvres Gaulois. Le lendemain, ils étaient les méchants Romains. Un jour, il fallait protéger la minorité francophone de la majorité anglophone qui l’écrasait. Le lendemain, il fallait protéger la minorité anglophone de la majorité francophone qui l’étouffait. Bizarre, non? Pourquoi, dans un pays qui voue un culte à ses minorités, les francophones ne sont pas – ne sont plus, en fait, car ils l’ont déjà été – considérés comme une minorité? Et que pourrions-nous faire pour redevenir une minorité aux yeux de l’élite canadienne? Car c’est ce que nous sommes! Une minorité dans le Canada! Qui doit être traitée avec tous les égards que le Canada – surtout le Canada de Justin Trudeau – voue à ses minorités! LE RETOUR D’EXPO 67 J’ai eu une réponse à ma question l’autre jour, lors d’un souper que nous avons organisé ma blonde et moi. On recevait un groupe de jeunes intellectuels nationalistes, des gars brillants dans la trentaine. Je leur disais que j’avais été surpris de voir, lors de la première d’un spectacle à la Place des Arts, un animateur de radio noir porter un boubou, un vêtement traditionnel africain qui ressemble à une robe et qui est porté autant par des hommes que des femmes. J’étais surpris car, habituellement, ce gars (qui semblait toujours sortir des pages du magazine de mode GQ) portait une chemise, un veston, une cravate, etc. Bref, des vêtements «occidentaux». Comme ceux portés par un autre dandy, PK Subban! Or, voilà que cet animateur qui était toujours tiré à quatre épingles portait un boubou, comme s’il voulait dire à tout le monde qu’il avait reconnecté avec ses «origines» africaines, même s’il est né dans un petit village au Québec. Réaction de l’essayiste David Santarossa, qui était présent au souper: «C’est ça que les Québécois devraient faire! Porter des vêtements traditionnels! Renouer avec nos racines! Porter des signes folkloriques ostentatoires! C’est comme ça qu’on redeviendra enfin une minorité aux yeux de l’élite canadienne!» Avouez, l’idée est excellente. Car c’est comme ça que les membres de l’élite canadienne voient leur pays: comme une sorte de grosse exposition universelle, avec le pavillon de l’Inde, le pavillon de la Turquie, le pavillon de la Chine, etc. Chaque pavillon rempli de gens portant des vêtements traditionnels et jouant de la musique folklorique de leur pays d’origine. C’est ça, le Canada de Justin Trudeau! Expo 67! Avec les «steel drums» du pavillon de Trinidad et les balalaïkas du pavillon de la Russie! SORTONS NOS MOUSQUETS! Alors, allons-y, les amis! Portons des vêtements traditionnels, rappelant à tout le monde que nous formons nous aussi une minorité ethnique! Chaussons des raquettes! Enfonçons-nous une tuque sur la tête! Portons un gros manteau de chat sauvage! Sortons notre ceinture fléchée et nos vieux mousquets! Déguisons-nous comme le patriote sur le drapeau! Car c’est ça que Justin aime, c’est ça qui le fait triper: des costumes! Regardez comment il s’habillait lors de sa tournée mémorable en Inde! C’est comme cela que nous redeviendrons une minorité à protéger!!! Avançons par en arrière, comme disent les chauffeurs d’autobus! "
76,23-08-21,Les p’tits criss,https://www.journaldemontreal.com/2023/08/21/les-ptits-criss,jeunesse,"J’arrive d’un mois à Paris. J’ai passé 30 jours dans des musées, des restos, des cafés... Et ce mois passé parmi la foule, sans jamais m’isoler dans ma chambre d’hôtel, n’a fait que confirmer ce que je soupçonnais depuis un bout de temps. Les parents ont baissé les bras. Mick Jagger a raison Je sais, j’ai déjà écrit là-dessus, mais j’y reviens car ce laisser-aller général en dit long sur notre Société et le rapport complètement tordu que nous entretenons avec le concept d’autorité. C’est fou à quel point les parents ont de la difficulté à assumer leurs responsabilités. À dire Non à leurs enfants. Comme si c’était une forme de maltraitance. Tenez, un exemple... On va dans un magnifique musée, ma blonde et moi. Un peu partout dans le musée, des écriteaux invitent les parents à s’assurer que leurs enfants respectent les lieux et les autres visiteurs. Une femme se pointe avec son enfant. Le p’tit criss hurle et court pendant une heure. Il était dans une salle située à l’autre bout du musée, et je l’entendais crier à pleins poumons. Une peste. Terminator en culotte courte. Que faisait sa mère? Elle le regardait en souriant. La tête penchée sur le côté comme Marie devant le p’tit Jésus. Autre scène. Nous sommes dans un café. Trois enfants allemands gavés à ras bord de sucre se comportent comme des hooligans dans un festival de la bière. Que faisaient leurs parents? Ils les regardaient en souriant. La tête penchée sur le côté comme un Bavarois devant une choucroute. J’avais envie de me lever et d’aller leur dire: «Vous savez, les parents peuvent dire NON à leurs enfants! Ce n’est pas interdit. Dans la majorité des cas, c’est même recommandé. On pourrait même dire que dire NON est la job principale des parents!» «Une famille est comme le club-école de la Société. C’est là où l’on apprend les règles de base. Comme le respect. Et l’importance des LIMITES.» «Comme disent les Rolling Stones: You Can’t Always Get What You Want. C’est ça, le rôle d’un père et d’une mère: apprendre le concept de LIMITES à leurs enfants. Pour que plus tard, ces enfants puissent fonctionner EN Société!» Le ministre et le cellulaire Regardez le dossier du téléphone cellulaire à l’école. Il n’y a aucune bonne raison de permettre l’usage du cellulaire en classe. Aucune. Or, le ministre de l’Éducation peine à agir. Pourquoi? Peut pas dire Non. Il regarde les jeunes pitonner sur leur cell en classe en souriant. La tête penchée sur le côté comme un ministre caquiste de la région de Québec devant une maquette du troisième lien. Un enfant est un monstre d’égoïsme. Tout ce qui lui importe, c’est MOI, MOI, MOI. C’est le rôle des parents de prendre cette masse informe et de la sculpter pour qu’elle finisse par ressembler à un citoyen. Or, on le fait de moins en moins. Résultat: notre Société ressemble de plus en plus à une garderie illégale où la bonne femme dort devant la télé pendant que 15 p’tits criss laissés à eux-mêmes crient, braillent et morvent."
77,23-08-22,Nous vivons une crise de l'autorité,https://www.journaldemontreal.com/2023/08/22/nous-vivions-une-crise-de-lautorite,wokes,"Lundi, dans ma chronique, je parlais pour une énième fois de ces parents qui ont baissé les bras et qui laissent leurs enfants agir à leur guise. Comme si dire Non à leurs enfants était une forme de maltraitance... L’ÈRE DES «MICROAGRESSIONS» Après ça, on se demande pourquoi il y a si peu de jeunes qui veulent devenir profs, policiers, ou même arbitres dans les ligues de sport amateur! Tu donnes une mauvaise note à un élève? Le parent débarque dans ton bureau et t’engueule. Tu pénalises un joueur? Le père descend sur le terrain et te casse la gueule. Tu emploies la force pour arrêter une bande de délinquants qui refusent d’obtempérer à tes ordres? Tu es traité de tous les noms et risques d’être traîné devant un comité de discipline. Ça n’explique pas tout, mais c’est certainement une partie du problème. Qui est intéressé à incarner l’autorité dans un monde qui se méfie de plus en plus de l’autorité? Un monde qui considère l’autorité comme une forme de fascisme? Tenez, je suis allé sur le site synonymo.fr pour savoir quels sont les synonymes du mot «autorité». Voici les résultats: «absolutisme», «arbitraire», «autoritarisme», «omnipotence», «oppression», «tyrannie», «totalitarisme», «toute-puissance», «despotisme», «supériorité», «domination». Demandez aux employeurs si c’est facile, maintenant, de critiquer un employé, de lui dire qu’il fait mal son travail. Ils vont vous répondre que c’est de plus en plus délicat, que les relations employeur-employé sont devenues un terrain miné. La moindre petite critique, même formulée doucement, est perçue comme une forme d’agression. C’est d’ailleurs pourquoi les wokes ont inventé le mot «microagression». Pour pouvoir transformer en «agression» le moindre commentaire négatif. LES POTS CASSÉS Pas surprenant, dans ce contexte, qu’on traverse une grave pénurie de main-d’œuvre dans certains métiers et certaines professions! Les parents ne font plus leur job! Et qui se retrouve à faire le boulot à leur place et à ramasser les pots cassés? Les profs! Les policiers! Les arbitres! Les employeurs! Essayez de dire NON à un enfant qui s’est toujours fait dire OUI par ses parents! Essayez d’inculquer une quelconque forme de respect de l’autorité à un jeune qui n’a jamais été puni lorsqu’il faisait preuve d’impertinence, d’insolence et d’irrévérence envers ses parents! «Toutte est dans toutte», disait le très sage Raôul Duguay. Former un citoyen, ça commence à la maison. Mais que voulez-vous, maintenant, être poli est considéré comme un aveu de faiblesse, un manque de caractère. Oui, il y a eu pendant beaucoup trop longtemps des policiers, des profs, des employeurs et des parents toxiques, qui abusaient de leur position d’autorité. Mais on est passé d’un extrême à un autre. «Trop, c’est comme pas assez», dit l’adage. Mais ça joue aussi en sens inverse. Pas assez, c’est comme trop. ET LES DEVOIRS? Les enfants ne sont pas fous. Qu’est-ce qu’ils entendent lorsqu’ils écoutent les adultes parler? «J’ai le droit», «C’est mon droit», «Libaaarté»! Alors ils répètent. Quelque chose me dit que ce n’est pas demain qu’on va régler le problème de pénurie de main-d’œuvre chez les profs et les policiers... "
