id,date,title,link,sujet,texte
29,23-06-13,Fermeture du chemin Roxham: où est la catastrophe annoncée?,https://www.journaldemontreal.com/2023/06/13/fermeture-du-chemin-roxham-ou-est-la-catastrophe-annoncee,immigration,"Vous rappelez-vous ce que certains «experts» disaient quand on a commencé à demander au gouvernement fédéral de fermer le chemin Roxham? «Ça va être épouvantable, des centaines de migrants vont passer par le bois et ça va mettre leur sécurité en danger ! Il ne faut pas fermer le chemin Roxham, il faut plutôt construire de nouvelles installations pour accueillir les migrants!» Or, non seulement la vague de réfugiés potentiels entrant au Canada a considérablement ralenti une fois le chemin Roxham fermé, en mars dernier, mais elle s’est presque arrêtée. À tel point que la GRC a commencé à plier bagage il y a trois semaines! UNE «CATASTROPHE HUMANITAIRE!» «Monsieur Trudeau, permettez-moi de dire que d’avoir fermé le chemin Roxham est la plus mauvaise décision que vous ayez prise depuis que vous êtes premier ministre», a lancé Samira Jasmin, du réseau de justice migrante Solidarité sans frontières, le 29 mars dernier. «Oui, M. Trudeau, vous avez cédé aux pressions racistes, populistes, en prenant cette décision ! C’est triste parce que malgré cette fermeture, les personnes et les familles continueront de venir en utilisant des chemins plus dangereux et moins dignes...» Le 13 avril, Médecins Sans Frontières Canada et Médecins du Monde Canada ont quant à eux signé une lettre ouverte affirmant que la fermeture du chemin Roxham «n’empêchera pas les gens de rechercher la sécurité qu’ils ne trouvent plus dans leur pays d’origine, elle les obligera seulement à emprunter des itinéraires plus dangereux...» Québec solidaire, le Syndicat canadien de la fonction publique, Solidarité sans frontières, le Comité d’action des personnes sans statut, le Collectif Bienvenue, le Centre des réfugiés de Montréal, Foyer du Monde, sans oublier des profs de l’Université Concordia et de l’UQAM: tous ont affirmé que la fermeture du chemin Roxham, loin de régler le problème des migrants irréguliers, allait au contraire l’exacerber. «Ça va être une catastrophe humanitaire!» a dit Stephan Reichhold, directeur de la Table de concertation des organismes au service des personnes réfugiées et immigrantes. Ah oui? Où? Quand? Certes, quelques migrants vont toujours essayer d’entrer au Canada par la forêt (comme cela a toujours été le cas, même avant l’ouverture du chemin Roxham), mais ce n’est pas de ça qu’on parlait en mars dernier. On annonçait une catastrophe! Des morts par centaines! Des hordes d’immigrants entrant au pays par les bois! Une ruée! Une crise! Eh bien, elle est où, cette crise? UN TWEET IRRESPONSABLE La réalité, c’est qu’il n’y a pas eu de crise. Que la catastrophe humanitaire tant annoncée par les groupes communautaires ne s’est jamais réalisée. Que la situation est rapidement revenue à la normale. Et que la fermeture du chemin Roxham, que la majorité des Québécois réclamaient, était finalement une bonne idée. D’ailleurs, ne l’oublions pas: si autant de migrants se sont rués vers le chemin Roxham, ces dernières années, c’est parce que Justin Trudeau — pour avoir l’air cool — a publié un tweet invitant tous les miséreux du monde entier à se pointer à nos frontières. La crise n’a pas été causée par la fermeture du chemin Roxham. Mais par ce tweet irresponsable envoyé par notre PM. "
30,23-06-14,Le chef Dagher joue au Kid Kodak pendant que la criminalité explose...,https://www.journaldemontreal.com/2023/06/14/le-chef-dagher-joue-au-kid-kodak-pendant-que-la-criminalite-explose,police,"La semaine dernière, on a appris que la criminalité explose à Montréal. Depuis 2017, la ville a connu une hausse spectaculaire du nombre de meurtres (+43 %), de crimes contre la personne (+21 %), de crimes contre la personne avec arme à feu (+29 %), de décharges d’arme à feu sans victimes (+87 %), de voies de fait (+28 %), d’agressions sexuelles (+12 %)... Bref, rien ne va plus. On le sentait. Mais maintenant, on le sait. Montréal est une ville de plus en plus violente. LES AVENTURES DE KID KODAK Et qu’a fait Fady Dagher, le chef du SPVM, ces derniers jours? Ce qu’il aime le plus faire, c’est-à-dire poser devant les caméras pour les fins d’un reportage – cette fois-ci, dans La Presse. «Pendant cinq jours, nuits comprises, le chef du SPVM s’est immergé dans les populations vulnérables et les enjeux sociaux aigus. La Presse l’a suivi pendant deux jours.» On a eu droit à Fady Dagher dort à la Maison du Père («dans des draps qui sentent le moisi»). Fady Dagher dort à la Mission Old Brewery. Fady Dagher dort à Projets autochtones du Québec. Fady Dagher dort à Cap St-Barnabé à Hochelaga-Maisonneuve. Fady Dagher mange avec les sans-abri. Fady Dagher va dans une classe de francisation. Fady Dagher se fait coiffer par un barbier communautaire. Fady Dagher joue au soccer avec des jeunes. Fady Dagher mange dans un centre communautaire haïtien. «Les jeunes veulent tous leur photo avec le chef. “C’est toujours comme ça, partout dans les rues de Montréal”, rigole le garde du corps de Dagher. Le policier a parfois l’impression de veiller sur une rock star.» Je n’ose imaginer ce que certains policiers du SPVM, qui en ont plein les bras et qui passent leurs journées à courir d’une scène de crime à une autre, ont pensé en regardant ce reportage vantant «la méthode Dagher». On comprend que monsieur Dagher est le «visage» du SPVM. Que les relations publiques font partie de son travail. Et que si le chef du SPVM a participé à ce publireportage, c’est qu’il voulait montrer qu’au SPVM, on ne voulait pas seulement lutter contre le crime. PAS LE TEMPS DE JOUER AU BALLON On voulait aussi «construire des ponts avec les communautés vulnérables». Cette expérience d’immersion sur le terrain sera d’ailleurs obligatoire pour toutes les recrues du service de police. Mais je me pose une question... On veut lutter contre le crime en amont? Parfait! Il y a des gens qui font exactement ça: les travailleurs sociaux et les employés et bénévoles des organismes communautaires. C’est leur mission première. Qu’on les subventionne adéquatement! Le rôle de la police, lui, est tout autre. C’est d’appréhender les bandits une fois qu’ils ont commis leur crime. Demande-t-on aux travailleurs sociaux de faire le boulot des policiers ? Non. Alors je ne vois pas pourquoi on demanderait aux policiers de faire le boulot des travailleurs sociaux. Chacun son rôle. Les policiers sont déjà assez débordés comme ça. Ça me surprendrait qu’ils aient le temps de jaser et de jouer au ballon. Ils éteignent des feux. Comme les pompiers."
31,23-06-15,"Pas de cellulaire en classe, point final!",https://www.journaldemontreal.com/2023/06/15/pas-de-cellulaire-en-classe-point-final,jeunesse,"La prochaine fois que vous entendez un ministre du gouvernement Legault dire qu’il va régler un problème hyper complexe, dites-vous une chose... Ce gouvernement n’est même pas foutu d’interdire le cellulaire en classe. Trop délicat, paraît-il... Trop difficile... Il faut réfléchir, effectuer des études, peser le pour et le contre, oh là là, quel casse-tête... Et ce sont ces gens-là qui vont révolutionner le système de santé? Ahahahahah! Quand tu n’es même pas capable de changer le rouleau de papier de toilette, ne viens pas me dire que tu vas rénover la cuisine! DRING! DRING! Le ministre Drainville ne veut pas interdire le cellulaire dans les classes du primaire et du secondaire! Pourquoi, bon Dieu? Nommez-moi une raison, une seule, pourquoi un enfant de dix ans devrait avoir accès à son cellulaire en classe! Allez-y, j’attends... Une raison, juste une, monsieur Drainville! Me semble que ce n’est pas compliqué... On ne parle pas ici de lutter contre les changements climatiques, bordel! Mettez votre cellulaire dans la boîte de carton qui est sur mon bureau, et allez vous asseoir! C’est pas de la physique quantique! Pas besoin d’avoir un postdoctorat en philosophie de l’éducation de l’Université de Klagenfurt en Autriche pour se rendre compte que le cellulaire n’a pas sa place en classe! Vous imaginez si, au beau milieu de l’écriture d’une chronique, j’arrêtais tout pour répondre à un appel? «Hein, quoi? Tu vas faire l’épicerie? Oui, apporte-moi du jus d’orange! Sans pulpe, s’il te plaît! Et il manque aussi des bagels... Oui, à tantôt ma belle, je t’aime!» Euh, bon... Qu’est-ce que je disais, déjà? Ah oui, le cellulaire ! Il me semble qu’on n’a pas — Dring! «Maman, je t’ai dit de ne pas m’appeler quand j’écris ma chronique! Oui, ça fonctionne toujours pour demain! À midi! J’ai réservé, oui! À la même place, oui! OK, bye!» PAS DE PÉPEINE Moi, je m’excuse, mais si tu n’es pas capable de faire bouillir de l’eau, ne me dis pas que tu vas me préparer un bœuf Wellington pour souper! La majorité des études conseillent l’interdiction du cellulaire en classe. La plupart des parents sont d’accord. Tous les profs le réclament. À genoux. Les mains jointes. Un sac rempli de glace sur la tête et deux Valium dans la bouche. Qu’est-ce que vous attendez, saint joualvert, pour le dire? «Pas de cellulaire en classe!» Quoi, vous avez peur de faire de la pépeine aux enfants? À ce que je sache, un enfant de 12 ans n’a pas besoin de consulter l’état de la Bourse aux 10 minutes pour savoir s’il doit vendre ou non ses actions de Dollarama! On est en train de demander à des conducteurs de Zamboni s’ils ne voudraient pas être profs, on donne des cours dans des conteneurs à déchets, on va bientôt dire que le mot éléphant s’épelle «éléfan», on enseigne que les femmes et les hommes, ça n’existe plus... Mais on ne veut pas interdire le cellulaire en classe, car c’est trop «délicat»? Wow. Parlez-moi d’un gouvernement qui veut «shaker» les colonnes du temple!"
32,23-06-17,Justin Trudeau veut savoir avec qui vous couchez!,https://www.journaldemontreal.com/2023/06/17/justin-trudeau-veut-savoir-avec-qui-vous-couchez,action affirmative,"avez-vous qui j’adorerais interviewer à mon émission de radio à QUB ? Marie-Claude Bibeau, ministre fédérale de l’Agriculture et de l’Agroalimentaire. Je lui demanderais si elle est bisexuelle. Si elle a déjà participé à des orgies. Et si ça lui arrive de porter un jackstrap. À VOILE ET À VAPEUR Quoi, c’est pas de mes affaires ce qui se passe dans le lit de Mme Bibeau ? Ça serait malpoli ? Je n’ai pas le droit de poser des questions aussi intimes ? Alors pourquoi son ministère pose ce genre de questions aux agriculteurs ? Pourquoi est-ce si important pour Mme Bibeau de savoir si le fermier Joe Blow qui habite sur le rang 3 de Sainte-Cyril-les-Garnottes est à voile et à vapeur ? S’il s’amuse avec son cousin une fois qu’il a fini de traire ses vaches ? Il me semble que ce n’est pas de ses oignons non plus ! Après tout, comme disait Trudeau père, l’État n’a pas d’affaire dans la chambre à coucher des gens, non ? Malheureusement, si papa (qui savait s’amuser) ne voulait rien savoir de la façon dont nous nous envoyons en l’air, Trudeau junior, lui, est comme Janette Bertrand. Il veut savoir. Tout juste s’il ne se cache pas sous notre lit avec des jumelles pour voir qui nous pogne le schtroumpf le samedi soir quand il n’y a pas de hockey... Vous trouvez que j’exagère ? Même pas. Récemment, Ottawa a annoncé un programme d’aide pour les agriculteurs qui veulent entreprendre un virage « vert ». Pour avoir droit à l’aide maximale, il faut être autochtone, femme, membre d’une minorité visible, handicapé et/ou membre de la communauté LGBTQ2+. Tu es un homme blanc hétérosexuel qui ne souffre d’aucun handicap ? Tu vas recevoir moins d’argent que ta voisine qui est une lesbienne autochtone en fauteuil roulant. C’est ça, le Canada de Trudeau. On veut savoir ce que le gars qui fait pousser les carottes qu’on achète chez Metro ou chez IGA fait dans sa chambre à coucher. Paraît que c’est bien important pour l’avenir du secteur agroalimentaire canadien. Parce que vous ne le savez peut-être pas, mais c’est ça, le gros problème, dans le domaine de l’agriculture au Canada. Il n’y a pas assez de bisexuels qui traient des vaches. CARMEN CAMPAGNE Quoique, lorsqu’on y pense... Un pis de vache, c’est une mamelle. Et ça ressemble à un pénis. J’imagine que c’est ce qui a inspiré les fonctionnaires d’Ottawa. Ils se sont dit qu’il n’y a rien comme une personne bisexuelle pour manipuler un tel organe. C’est peut-être pour ça que le fermier de Carmen Campagne n’était pas capable de tirer sa vache : il était hétéro. Moi, si j’étais chef du Parti conservateur, je m’engagerais à interdire au gouvernement et à toutes les entreprises canadiennes de poser quelque question que ce soit sur la vie sexuelle des citoyens. Quelque chose me dit que les gens aimeraient ça, entendre ça. Parce qu’on commence à en avoir ras le pompon. C’est bien beau, aider les minorités. Mais trop, c’est comme pas assez. Comme dit le proverbe : ce n’est pas parce qu’une vache crie plus fort qu’elle va donner plus de lait. "
33,23-06-19,Bernard Drainville est-il un homme?,https://www.journaldemontreal.com/2023/06/19/bernard-drainville-est-il-un-homme,genres,"Monsieur le ministre de l’Éducation, j’ai une question pour vous. Êtes-vous un homme ? Ou juste un individu possédant un pénis ? LA THÉORIE DU GENRE EN CLASSE Je vous pose cette question car, si je me fie à la chronique que Jean-François Lisée a publiée dans Le Devoir samedi, la théorie du genre voulant qu’il suffise qu’on se sente « homme » ou « femme » à l’intérieur pour être considéré comme « homme » ou « femme » a le vent dans les voiles dans les écoles du Québec. Terminée, l’époque où l’organe qu’on avait entre les cuisses à la naissance déterminait notre genre ! Maintenant, des adeptes de la théorie du genre sont invités à venir dans nos CPE et dans nos écoles pour dire à nos enfants – et ce, dès leur plus jeune âge – que la biologie est une science dépassée et que le ressenti a désormais préséance sur l’anatomie ! « Vous vous sentez fille ? Alors vous êtes une fille ! » Vous me direz que la dysphorie de genre existe bel et bien, que c’est un trouble d’identité dûment documenté et pas juste une lubie. Je veux bien. Mais peut-on s’entendre pour dire que ce trouble (car, oui, c’est un trouble) ne touche qu’une infime partie de la population ? Connaissez-vous l’apotemnophilie ? C’est un « trouble identitaire de l’intégrité corporelle » qui fait qu’une personne qui a tous ses membres se sent « handicapée » en dedans. Des personnes souffrant d’apotemnophilie vont jusqu’à se faire amputer un membre – ou à se crever les yeux – pour « enfin » vivre dans un corps qui correspond à la façon dont ils se perçoivent « à l’intérieur ». C’est un trouble documenté. Qui existe. Et qui est reconnu par les plus hautes autorités médicales. Va-t-on enseigner à nos enfants que s’ils le veulent, ils pourraient demander à un médecin de leur amputer un bras ou une jambe ? STOP ! « Je sais que le ministre de l’Éducation en a plein les bras par les temps qui courent, écrit Jean-François Lisée à la fin de sa chronique. Mais à l’heure où l’on s’apprête à reconduire cette pédagogie hasardeuse au sein du nouveau cours Citoyenneté québécoise, je n’ai qu’un mot à lui dire : pause ! » Je dirais quant à moi pas seulement « pause », mais « stop » ! Ce n’était pas suffisant d’implanter le cours d’Éthique et de culture religieuse qui banalisait le voile ? Il faut maintenant dire à nos enfants qu’ils peuvent changer de sexe comme ils changent de chemise ? Pas étonnant que nos enfants soient de plus en plus anxieux... Monsieur Drainville, quand une femme appelle à la maison pour parler à mon épouse, je ne lui dis pas : « Chérie, un individu avec un utérus veut te parler ! » Je dis « Une femme veut te parler », comme 99,9 % de la population ! Nos enfants ont de la difficulté à lire, à écrire et à calculer. Le niveau ne cesse de baisser. Même au primaire. Notre système d’éducation peut-il régler ces problèmes de base avant d’enseigner une théorie hyper controversée, qui suscite de nombreuses inquiétudes au sein de la communauté scientifique elle-même ? En tout cas, moi, comme parent (je dirais même – oui, oui – comme « père »), c’est comme ça que je me sens en dedans. "
34,23-06-19,"On se prépare un bel avenir, un beau monde!",https://www.journaldemontreal.com/2023/06/19/on-se-prepare-un-bel-avenir-un-beau-monde,wokes,"Pensez à ça deux minutes. Bientôt, l’intelligence artificielle pourra réaliser et diffuser des vidéos qui feront dire n’importe quoi à n’importe qui. Le citoyen moyen sera de moins en moins instruit. Les gens liront de moins en moins et passeront de plus en plus de temps devant des écrans. UNE Société MORCELÉE, DIVISÉE Les médias traditionnels seront remplacés par des blogues rédigés par des inconnus qui n’auront aucun compte à rendre à quiconque. Le divertissement rem placera l’art. Les musées seront dirigés par des idéologues. De plus en plus de gens travailleront de chez eux. Les gens seront de moins en moins confrontés à des individus qui ne penseront pas comme eux. La Société sera morcelée, éclatée, fragmentée, divisée, compartimentée, segmentée, fractionnée. Divisée en silos. En chapelles. Nos amis nous parleront de séries télé dont nous n’aurons jamais entendu parler. Et nous leur parlerons de séries télé dont ils n’auront jamais entendu parler. Nous n’aurons plus aucune référence commune. Nous nous informerons tous à des sources différentes. Il n’y aura plus de peuples, que des communautés, des clients, des publics cibles, des groupes d’âge, des utilisateurs, des consommateurs potentiels et des tranches démographiques. Les multinationales seront plus puissantes que les nations. De plus en plus de gens quitteront la réalité pour se réfugier dans le métavers, où ils pourront s’inventer une vie qui s’accordera enfin à leurs désirs. Nous serons de plus en plus intéressés par la vie privée des personnes en position d’autorité, et de moins en moins intéressés par les idées qu’elles proposent. Nous n’aurons plus confiance dans la police, la politique, le système de justice et le journalisme. LE RÈGNE DU RESSENTI Le culte de la subjectivité aura raison de la science. On dira que « 2 + 2 = 4 » n’est plus une réalité objective, mais une construction sociale créée par un petit groupe d’hommes blancs hétérosexuels afin de consolider leur pouvoir et dominer le monde. On pourra changer de genre comme on veut. Puis changer de race. Et enfin changer d’espèce. L’homme pourra enfin devenir ce qu’il veut. Aucune réalité objective ne pourra faire obstacle à ses désirs. Ni la maladie, ni la vieillesse, ni la mort. L’important sera « comment on se sent ». Le ressenti de tous et chacun prédominera sur la réalité objective. La notion du « vrai » disparaîtra. Puis celle du « beau ». « Things are going to slide in all directions/Won’t be nothing you can measure anymore », chantait Leonard Cohen dans sa chanson prophétique The Future (1992). On ne pourra plus rien mesurer, il n’y aura plus de règles ni d’étalons, on ne pourra plus rien comparer. Le haut deviendra le bas, la gauche deviendra la droite. Les gens qui auparavant combattaient la censure la préconiseront, et ceux qui pourfendaient naguère la religion la célébreront. On verra des féministes provoile, des progressistes qui marcheront main dans la main avec des extrémistes religieux homophobes et des antiracistes racistes... Nous défendrons les droits des criminels, et traiterons de fascistes ceux qui prendront la défense de leurs victimes. LES LENDEMAINS QUI (DÉ)CHANTENT C’est ça, l’avenir qu’on est en train de construire, les amis. Génial, non ?"
35,23-06-20,"Si QS est souverainiste, alors je suis fédéraliste!",https://www.journaldemontreal.com/2023/06/20/si-qs-est-souverainiste-alors-je-suis-federaliste,wokes,"L’autre jour, à LCN, un journaliste demandait à un militant de QS qui il verrait comme co-porte-parole de son parti. «Moi, c’est Ruba Ghazal, a-t-il dit. Car c’est la seule des trois candidates à prendre ouvertement position pour la souveraineté du Québec.» Euh... Mme Ghazal dit qu’elle vote NPD au fédéral! C’est ce que vous appelez une souverainiste? Si Ruba Ghazal est souverainiste, alors moi, je suis fédéraliste, car il m’arrive de manger des biscuits en forme de feuille d’érable. LE PARADIS SUR TERRE Savez-vous quelle est la différence entre QS et le PQ en ce qui concerne la souveraineté? Pour QS, la souveraineté est un moyen pour faire advenir le paradis sur terre, alors que pour le PQ, la souveraineté est une fin en soi. Pour QS, la souveraineté est un voyage, alors que pour le PQ, c’est la destination. Pour QS, la souveraineté est un wagon, alors que pour le PQ, c’est la locomotive. Pas la même chose du tout. C’est comme deux gars qui se disent féministes. Le premier est féministe parce que les féministes baisent mieux, elles sont plus libérées sexuellement, elles sont indépendantes financièrement, tu n’as pas besoin de payer pour elles au resto, elles ne veulent pas nécessairement vivre avec leur conjoint, elles ne perçoivent pas la maternité comme la huitième merveille du monde, elles considèrent le mariage comme un piège patriarcal, bref, elles permettent aux hommes d’être plus libres et leur cassent moins les couilles. Pas de mariage, pas d’enfant, pas d’attache financière, la paix, la sainte paix! Alors que le second est féministe parce que c’est la chose à faire. Parce qu’il ne peut imaginer le monde autrement. Parce que ça tombe sous le sens. Et non parce que ça le sert, lui. QS veut que le Québec devienne un pays écolo, socialiste, contre la laïcité, pour l’ouverture des frontières, contre le capitalisme, contre les autos, contre la binarité sexuelle, contre les valeurs patriarcales, contre le colonialisme, pour le langage inclusif, pour ajouter des chiffres et des lettres à l’acronyme LGBTQ2+ et pour la défense des rainettes faux-grillons. Alors que le PQ veut que le Québec devienne un pays, point. Un pays qui se donnera parfois des gouvernements de gauche, parfois des gouvernements plus à droite. Comme tous les pays du monde. UN MOUVEMENT SOUS INFLUENCE Certains déplorent le fait que le PQ ne participe pas à la Fête nationale de Québec sous prétexte que «la Fête nationale devrait être rassembleuse». Euh... Dites ça au Mouvement national des Québécois! Ce sont eux qui ont choisi de diviser en allant chercher un artiste tellement partisan qu’il va jusqu’à souhaiter la mort du PQ! Et de répéter que le seul parti ouvertement souverainiste au Québec est raciste! Un moment donné, assez, c’est assez! Le PQ n’a pas besoin de se pointer à côté d’un militant qui méprise tout ce qu’il représente pour souhaiter bonne fête nationale aux Québécois. Après une fête nationale sans drapeaux, voici une fête nationale qui s’associe à un artiste qui milite pour QS. Que se passe-t-il au Mouvement national des Québécois, au juste? "
