id,date,title,link,sujet,texte
1,23-05-03,"Dans nos cégeps et nos universités, on répète les erreurs du passé",https://www.journaldemontreal.com/2023/05/03/dans-nos-cegeps-et-nos-universites-on-repete-les-erreurs-du-passe,gauche,"**«Les peuples qui ne connaissent pas leur Histoire sont condamnés à la revivre», a dit Karl Marx.** Eh bien, c’est exactement ce qu’on fait. Au lieu de tirer les leçons du passé, on répète les erreurs qu’on a commises. C’est ce qui arrive lorsqu’on n’a pas de mémoire. Ou lorsqu’on ne connaît pas son Histoire. **LE RETOUR DES COCOS** Regardez ce qui se passe dans les cégeps et les universités. Une bande d’exaltés qui rêvent de révolutions tentent d’imposer leur idéologie et confondent éducation avec propagande et embrigadement. On a déjà vécu ça dans les années 1960-70, avec les maoïstes et les marxistes-léninistes. Quand je suis arrivé au cégep, il y avait encore des «cocos» qui vendaient _En lutte_, une feuille de chou qui faisait la promotion de la «révolution prolétarienne». On aurait dit les Témoins de Jéhovah. Une secte qui ânonnait d’insupportables âneries et qui vantait les mérites du régime dictatorial d’Enver Hoxha, un fou furieux qui semait la terreur en Albanie et qui n’avait rien à envier à Staline et à Ceausescu. Près de 20 ans après la publication d’_Une journée dans la vie d’Ivan Denissovicht_, d’Alexandre Soljenitsyne, qui avait alerté les gens aux exactions épouvantables qui se déroulaient en Union soviétique, ces zozos qui se prenaient pour Sartre parce qu’ils roulaient des cigarettes, brandissaient fièrement la faucille et le marteau! Aujourd’hui, on voit exactement la même chose. Mais on a remplacé le communisme par l’anarchisme, le wokisme et l’antiracisme zélé. Autres idéologies, même soif de censure, de procès sommaires et de pureté idéologique. Comme quoi les exaltés se suivent et se ressemblent. **LES CASSEURS** Autre virus qui revient à la mode: le terrorisme idéologique. L’idée que tous les moyens, même les plus violents, sont bons lorsque tu défends une cause «noble». Terroristes écolos qui vandalisent des autos et des œuvres d’art, militants anti-embourgeoisement qui brisent des vitrines de restos chic, artistes en mal d’attention qui encouragent la haine anti-police, anarchistes qui s’invitent dans des manifs pour foutre le trouble et tout casser, anti-fascistes fascistes — l’Histoire bégaie et se répète. «Et ça continue encore et encore», comme le chante Cabrel. Ils se disent «militants» alors qu’ils ne sont que des délinquants qui se cachent derrière de belles causes pour laisser libre cours à leur rage et faire leur petite danse du bacon en toute impunité. Ça aussi, on l’a vécu dans les années 1960-70. Et ces méthodes ont, au mieux, mené à des culs-de-sac, et, au pire, pavé la voie à la répression. N’importe quelle personne qui connaît le moindrement son Histoire vous le dira... S’il n’y avait pas eu le FLQ, pas sûr qu’il y aurait eu le rapatriement de la Constitution et la Charte des droits, qui ont étouffé le Québec. Mais que voulez-vous, nous vivons dans un monde de plus en plus dénué de mémoire... **QUE LA FARCE SOIT AVEC VOUS** «L’Histoire se répète toujours deux fois, a dit (encore) Karl Marx. La première, comme tragédie, la seconde, comme farce.» On est en plein dans la farce. Et, comme disait le magazine _Croc_, c’est pas parce qu’on rit que c’est drôle..."
2,23-05-04,Montréal est devenu un asile à ciel ouvert,https://www.journaldemontreal.com/2023/05/04/montreal-est-devenu-un-asile-a-ciel-ouvert,capitalisme,"Vous souvenez-vous quand Montréal était une ville sécuritaire? On y commettait des crimes, bien sûr, mais c’étaient des crimes motivés par l’appât du gain. Des vols de banque, du trafic de drogues, des prêts usuriers...La petite pègre, la mafia. Ce qu’on appelait le crime «organisé». Avec des chefs, des soldats, des règles. Mais aujourd’hui, c’est l’anarchie. Des passants se font tuer, on ne sait même pas pourquoi. Un regard de travers, mauvaise place au mauvais moment – pow, t’es mort! Deux bums ont tiré un jeune de 19 ans dans le ventre car ils voulaient son manteau. Ils auraient pu juste voler son manteau. Non, il fallait qu’ils lui tirent une balle dans le ventre. Pourquoi? Parce qu’ils le pouvaient, c’est tout. Ils avaient un gun, faut bien que ça serve, non? SAUVÉS PAR LE MÉTAVERS Les jeunes ne respectent plus l’autorité, déplorent les vieux. Eh bien, c’est comme ça aussi dans le monde criminel. Avant, les vieux mafieux pouvaient aller voir ces jeunes loups et leur dire de se calmer. «Vos folies attirent la police, c’est pas bon pour la business...» Mais aujourd’hui, même Vito Corleone ne pourrait faire entendre raison à cette bande de «frostés». On est passé du Parrain au Joker. Le crime n’est plus une business, c’est un passe-temps. On tire dans le tas pour tirer dans le tas. Pas étonnant que de plus en plus de gens restent chez eux, rivés à leur télé! Si j’étais scénariste, j’écrirais un film intitulé Frigo, porno, boulot. Tout le monde fait du télétravail. Le centre-ville est désert, les tours à bureaux sont abandonnées et servent de perchoirs à moineaux. Les commerces des grandes rues commerciales sont placardés et servent de squats à des sans-abri, des psychopathes et des toxicomanes. Les gens ne vivent plus dans la vraie vie – trop dangereux. Ils ont tous des lunettes de réalité virtuelle sur le nez, et vivent, bossent et s’amusent dans le métavers. On ne quitterait plus la ville pour la banlieue, mais la réalité pour le virtuel! Seuls les «losers» vivraient dans «le vrai monde». Les autres vivraient dans un univers propre, ordonné, géré par une multinationale. Un univers situé à mi-chemin entre Disneyworld et le Carrefour Laval. Où tu peux être qui tu veux, selon tes humeurs. Un homme, une femme, un animal. Un monde fluide, cool, qui épouse les contours de chacun de nos désirs et qui ne prie qu’à un seul dieu, une seule patrie, une seule idéologie: le dollar. Il n’y aurait plus de citoyens: que des consommateurs. VITE, UNE PILULE! J’exagère, mais à peine. On regarde les grandes villes, et c’est comme si on avait abdiqué, baissé les bras. Prenez Montréal: la ville ressemble de plus en plus à un asile à ciel ouvert, un dépotoir. Non seulement les policiers sont-ils débordés, mais ils refusent de faire certaines interventions, de peur de se retrouver devant un comité de déontologie. Le prix des maisons et des logements explose, les familles quittent. Quand il n’y a pas des manifs, ce sont des fusillades. Et on se demande pourquoi autant de gens sont sur les antidépresseurs..."
3,23-05-06,Comment les Trudeau ont noyé le Québec,https://www.journaldemontreal.com/2023/05/06/comment-les-trudeau-ont-noye-le-quebec,identité,"Justin Trudeau est comme le mouvement woke : on aurait tort de le considérer comme un être inoffensif, un amateur, un clown. Il est beaucoup plus dangereux – et beaucoup plus malin – qu’on ne le croit... La preuve ? Comme nous l’apprend le dossier du Journal publié aujourd’hui, Justin s’apprête à utiliser les grands moyens pour mener à terme le projet que son père a mis en branle au début des années 1980. Un projet destiné à diluer au max la présence francophone au sein du Canada. Et à transformer le peuple québécois en minorité ethnique pas plus importante que les minorités d’origine chinoise, indienne ou turque qui forment le « premier État postnational au monde »... LE COUP FATAL DE PIERRE ELLIOTT Avec la Charte des droits, qui affirmait que les droits individuels avaient priorité sur les droits collectifs, Pierre Elliott Trudeau a porté un dur coup aux souverainistes québécois. Car que disait ce bout de papier ? Que le Canada n’était plus une nation à proprement parler, mais un rassemblement d’individus lâchement reliés les uns aux autres par un contrat social... Comme les propriétaires d’un complexe de condos, qui s’entendent pour sortir les vidanges le jeudi et pour passer l’aspirateur dans les couloirs toutes les deux semaines. Idem pour le Québec : on ne pouvait plus parler d’une « petite nation québécoise » vivant au sein de la « grande nation canadienne », mais de citoyens canadiens vivant dans la province de Québec. Les Québécois avaient tendance à se regrouper tous ensemble comme des boules de couleurs différentes au centre d’une table de billard au début d’une partie ? La Charte de Trudeau-père était la boule blanche qui cassait ce beau triangle et envoyait toutes les boules se promener aux quatre coins de la table ! Terminée, la « nation » québécoise qui se considérait comme un « tout cohérent » ! Vous n’êtes plus qu’un regroupement d’individus, de citoyens et de payeurs de taxes ! Ça, c’était ce qu’on pourrait appeler l’étape 1 du plan Trudeau. LE COUP FINAL DE JUSTIN L’étape 2, c’est ce que s’apprête à faire son fils, Justin. Ouvrir au max les vannes de l’immigration pour noyer la présence francophone au pays et parachever l’œuvre de son père. Après la Charte, l’immigration massive. Après le bout de papier, l’inondation. Tout comme son père, qui s’est dit : « Qui osera combattre ma Charte ? Elle défend les droits et libertés ! Elle se situe du côté du bien ! », Justin se dit : « Qui, à cette époque obsédée par la diversité, va oser critiquer mon programme d’immigration ? Personne ! » L’objectif : 100 millions de Canadiens en 2100. À coup de 500 000 nouveaux arrivants par année. Du jamais-vu. Ce n’est même plus « ouvrir les vannes ». C’est faire sauter les vannes ! Pour Justin, le Canada n’est pas un pays. C’est un hôtel, un Airbnb. Et le Québec n’est qu’une des nombreuses chambres de ce vaste complexe immobilier. La chambre 237, tiens. Comme celle du film The Shining. Venez, déposez vos valises et installez-vous ! Tout ce qu’on vous demande, c’est de payer vos impôts. Le reste, ça vous regarde. C’est comme le tweet tristement célèbre que Justin a publié en janvier 2017 (« À ceux qui fuient la persécution, la terreur et la guerre, sachez que le Canada vous accueillera... »), mais à la puissance 10. Papa doit être fier de fiston. "
4,23-05-08,«Ils battent leurs enfants? C’est dans leur culture!»,https://www.journaldemontreal.com/2023/05/08/ils-battent-leurs-enfants-cest-dans-leur-culture,identité,"Dieu qu’on est niaiseux, parfois... En changeant la couche d’une petite fille de deux ans, une éducatrice de CPE de Québec s’est aperçue que les organes génitaux de celle-ci avaient été mutilés. La fillette n’avait plus de clitoris. Elle a probablement été excisée. L’éducatrice a appelé la DPJ pour qu’elle fasse enquête. Et qu’a répondu l’organisme qui, je le rappelle, est censé PROTÉGER LA JEUNESSE? «Bof, non, on n’interviendra pas, c’est trop délicat...» LES EFFETS PERVERS DU MULTICULTURALISME Trop délicat? Qu’est-ce qu’il y a de délicat là-dedans? Vous êtes la DPJ! Une fillette de deux ans a probablement été excisée! On lui a coupé le clitoris! Qu’est-ce que vous attendez pour agir, bordel? On est au Québec, ici! Nous avons des lois! Qui s’appliquent à tout le monde, quelles que soient notre origine, notre religion ou notre race! Qu’est-ce que ça vous prend pour que vous interveniez? «Trop délicat» !!! Quoi, on accepte que dans certaines communautés, on excise les fillettes ? Parce que «c’est comme ça qu’ils font, eux autres» ? Et que «nous n’avons pas à nous mêler de la culture des autres» ? C’est du colonialisme blanc de punir les parents qui coupent le clitoris de leur fille, c’est ça ? Du racisme ? De la xénophobie ? Le Code criminel qui régit la vie des citoyens est une tranche de gruyère remplie de trous ? Il prévoit toutes sortes d’exceptions afin de «respecter» les coutumes qui ont cours dans les pays d’origine des nouveaux arrivants? Certains pères ont le droit de battre leurs filles parce qu’elles ne portent pas le voile ? Certaines mères ont le droit de couper le clitoris de leurs fillettes pour les empêcher de jouir ? À force de se faire imposer un multiculturalisme zélé par Trudeau fils, on a fini par douter de nos valeurs, de nos traditions, de nos lois! On voit du racisme partout! Jusqu’à la DPJ qui se demande si elle a le droit d’agir quand on mutile une fillette !!! UNE VISION RACISTE Il y a quelques mois, sur le site de Radio-Canada, on lisait que des travailleurs sociaux trouvaient que les intervenants de la DPJ étaient trop vites sur la gâchette lorsqu’ils faisaient des interventions auprès de familles haïtiennes. Ils manquaient de sensibilité «culturelle» et avaient tendance à retirer trop rapidement les enfants haïtiens de leur famille. «Une des particularités de la culture haïtienne est celle des châtiments corporels. Culturellement, chez plusieurs personnes de cette communauté, les châtiments corporels, c’est quelque chose de normal», expliquait un travailleur social. Donc, les parents haïtiens battent tous leurs enfants, c’est ça? Et la DPJ devrait tenir compte de ce «trait culturel»? Il y aurait donc une différence entre un Blanc qui bat son enfant et un Noir qui bat son enfant? Cette vision des choses n’est pas seulement débile, elle est carrément raciste... Nous sommes TOUS des citoyens québécois. Nous avons TOUS les mêmes droits. Et les mêmes devoirs. Et un enfant noir, arabe, asiatique ou musulman qui se fait battre, c’est aussi inacceptable qu’un enfant blanc catholique qui se fait battre. Point final."
5,23-05-09,Couronnement du roi: une farce monumentale,https://www.journaldemontreal.com/2023/05/09/couronnement-du-roi-une-farce-monumentale,capitalisme,"Dans son livre Sapiens, qui s’est vendu à des millions d’exemplaires à travers le monde, l’historien israélien Yuval Noah Harari dit que l’homme a besoin de se raconter des histoires pour donner un sens à sa vie. Les religions, par exemple, sont des fictions qu’on a créées de toutes pièces pour tenter d’expliquer le monde. Les idéologies aussi. Le communisme et le capitalisme n’existent pas en soi. Ce sont des récits que nous avons créés. «Il n’y a pas de dieux dans l’univers, pas de nations, pas d’argent, pas de droits de l’homme, ni lois ni justice hors de l’imagination commune des êtres humains», dit Harari. LE SUMMUM DU RIDICULE Même chose pour l’autorité. Personne n’a d’autorité naturelle sur d’autres êtres humains. Ce sont les membres d’une Société qui confèrent de l’autorité à quelqu’un. On dit: «Cette personne représente l’autorité et il faut lui obéir.» C’est comme lorsqu’on joue au soccer, et qu’on choisit un arbitre. Cette personne n’est pas née «arbitre». Elle n’est pas «arbitre» par naissance. Elle a été choisie par l’ensemble des joueurs pour arbitrer la partie. On lui donne un chandail d’arbitre, et on dit: «Cette personne est un arbitre. Il faut respecter ses décisions, même si on n’est pas d’accord.» Je pensais à Harari lors du couronnement du roi Charles III. Pour les monarchistes (ceux qui croient à la fiction qu’est le système monarchique), cet événement était solennel, important. Historique. Mais pour les autres, ce couronnement était le summum du ridicule. Non, mais quelle farce monumentale! Tu prends un vieux monsieur quelconque, tu lui mets une couronne sur la tête et un bâton dans les mains, et soudainement, cet individu qui ressemble à des millions d’autres individus est investi d’un pouvoir spécial! Soudainement, il faut lui obéir ! Il devient sage! Il règne sur des millions d’êtres humains ! Comme ça, juste parce qu’il est né dans la bonne famille! Si ce n’était du système monarchique, qui a été inventé de toutes pièces, le gars serait peut-être facteur, épicier ou réparateur de balayeuses! Mais parce qu’il a un bâton dans les mains, il devient l’une des personnes les plus puissantes au monde! C’est fou, non? LE CARNAVAL Prenez la religion. Parce qu’un homme a un drôle de chapeau sur la tête, il peut dire à des millions d’êtres humains de ne pas manger telle ou telle nourriture, ou de ne pas allumer la lumière chez eux pendant le week-end ! Quand on y pense froidement, c’est complètement fou. On choisit un gars, on dit: «Lui va être notre guide spirituel», et on obéit à chacune de ses décisions, aussi absurdes et illogiques soient-elles. «Tu vas manger seulement avec ta main droite!» Pourquoi pas: «Tu vas sauter sur un pied pendant 45 minutes chaque jeudi»? Je regardais Charles et Camilla, avec leur ridicule couronne sur la tête, en train de faire des bye-bye dans leur carrosse, et je hurlais de rire. On aurait dit le couronnement de la reine au Carnaval de Québec, avec un gros budget... Qu’attendons-nous pour mettre fin à cette mascarade qui nous coûte des millions de dollars en pure perte? "
6,23-05-10,"Le Canada veut noyer le Québec, mais la CAQ dort au gaz",https://www.journaldemontreal.com/2023/05/10/le-canada-veut-noyer-le-quebec-mais-la-caq-dort-au-gaz,identité,"Gilles Proulx, avec qui j’échange tous les jours à QUB radio, me posait une bonne question l’autre jour... «Coudonc, c’est qui le premier ministre du Québec? François Legault ou Pierre Fitzgibbon?» Il n’est pas seul à s’interroger. Non seulement le ministre Fitzgibbon en mène-t-il de plus en plus large, mais plus ça va, et plus on a l’impression que les dossiers «identitaires» (immigration, laïcité, protection du français) doivent recevoir l’imprimatur du puissant ministre de l’Économie pour se retrouver sur le dessus de la pile. Imposer une connaissance du français aux travailleurs temporaires? Non, car nous sommes en pénurie de main-d’œuvre... Réclamer de nouveaux pouvoirs à Ottawa? Ce n’est pas le temps de déclarer la guerre au gouvernement fédéral, car nous avons besoin de son aide pour attirer les entreprises étrangères chez nous... Bref, c’est comme si, après avoir «réglé» les dossiers identitaires dans son premier mandat avec des lois timides, monsieur Legault pouvait enfin se consacrer aux choses importantes, c’est-à-dire l’économie. N’a-t-il pas déjà dit que la création de la richesse «est la base de tout», comme le rappelait Michel David dans Le Devoir en octobre 2022? Chassez le comptable, et il revient au galop. CHIEN QUI JAPPE NE MORD PAS Le hic est que le Canada, lui, ne lâche pas les dossiers identitaires, au contraire: il s’y attaque avec une vigueur renouvelée. Comme Le Journal le montrait le week-end dernier, Ottawa va ouvrir toutes grandes les vannes de l’immigration pour transformer la grenouille canadienne en bœuf et faire du pays une «puissance mondiale». Et qu’importe si l’inondation démographique qui s’ensuivra risque de détruire les barrières poreuses de la loi 101 et de noyer le Québec: on ne fait pas d’omelettes sans casser des œufs. Et que fait la CAQ pendant ce temps? Elle bombe le torse. «On ne se laissera pas dicter nos cibles annuelles de nouveaux arrivants, oh que non, que le gouvernement fédéral se le tienne pour dit!» Je suis sûr que les ténors du gouvernement Trudeau tremblent dans leurs culottes en voyant la ministre Christine Fréchette rouspéter et taper du pied... «Encore le Québec qui jappe. Mais ne craignez rien, il ne mord jamais... Il finit toujours par retourner dans sa niche... Bon chien!» C’EST QUOI, LE PLAN? J’aimerais que monsieur Legault m’explique deux choses. Quels sont les avantages à demeurer au sein du Canada, déjà? Nous ne réussissons même pas à convaincre le Canada de nous permettre d’avoir un rapport d’impôt unique ! Et vous croyez que vous pourrez transférer de nouveaux pouvoirs en immigration? Comment allez-vous réussir ce tour de magie? En le demandant poliment? En faisant chanter le Ô Canada à Bernard Drainville? En reniant trois fois de suite vos anciennes convictions souverainistes? En montrant patte blanche — pardon, patte rouge? On a essayé tout ça, et rien n’a fonctionné. C’est quoi, le plan, monsieur Legault? Qu’attendez-vous pour dire haut et fort que quoi qu’on dise et quoi qu’on fasse, le Québec est, aujourd’hui et pour toujours, une Société distincte, libre et capable d’assumer son destin et son développement? "
7,23-05-11,Langue: sommes-nous un peuple de perdants?,https://www.journaldemontreal.com/2023/05/11/langue-sommes-nous-un-peuple-de-perdants,langage,"Après les jeunes qui éprouvent de la difficulté à conjuguer leurs participes passés (les pommes qu’on a mangé, mangés ou mangées?), voici les jeunes qui coulent leur examen de français. Comme nous l’a appris ma collègue Daphnée Dion-Viens, lundi, moins d’un jeune sur deux a obtenu la note de passage en orthographe et en grammaire lors de l’épreuve de français de secondaire 5 en juin dernier. «Pour l’orthographe, non seulement ça ne s’est pas amélioré, mais ç’a beaucoup décliné après la pandémie. C’est assez alarmant», de dire une professeure en didactique du français. LES VRAIES AFFAIRES «Nous sommes quelque chose comme un grand peuple», a déjà dit René Lévesque. Euh... non, désolé.Les grands peuples sont fiers, ils maîtrisent leur langue. Ils savent comment l’écrire et comment la parler. Je ne me ferai pas d’amis, mais quand tu immigres, quand tu prends la dure décision de te déraciner et de changer de pays, c’est pour améliorer tes conditions de vie. Et quand tu veux améliorer tes conditions de vie, tu ne t’associes pas à des perdants, mais à des gagnants. Or, un peuple qui ne maîtrise pas sa langue maternelle est un peuple de perdants. C’est dur, mais c’est la réalité. Quand tu te fous de ta culture, quand tu te fous de ta langue, quand tu ne connais pas ton histoire, quand tu refuses de prendre les seules décisions qui s’imposent pour assurer la survie de ton peuple, quand tu te dis Non à deux reprises, quand tu préfères rester dans un pays qui te méprise plutôt que de relever tes manches comme l’ont fait tes ancêtres et construire un pays qui te ressemble, eh bien tu fais partie des perdants. Ne te plains pas, ensuite, si les gens qui viennent s’établir chez toi hésitent à rejoindre ton camp. À un moment donné, il faut se dire les vraies affaires! Ça fait des décennies qu’on voit notre maîtrise du français décliner, et ça fait des décennies qu’on ne fait rien. On regarde notre héritage s’écouler comme l’eau d’un bain dont on a retiré le bouchon, et c’est à peine si on hausse les épaules. On est comme fasciné. On se demande jusqu’où ça va aller. Et au lieu de nous montrer exigeants envers nos enfants afin de redresser la situation, on ne cesse au contraire de baisser la barre. On danse le limbo. Allez, plus bas ! Encore plus bas! Toujours plus bas! Après le joual, le franglais! Et après le franglais, le chiac! ÇA CHILL À L’OS! Et surtout, de grâce, n’imposez pas la dictée aux jeunes! C’est rétrograde! Réactionnaire! Ça impose des valeurs néolibérales comme la compétition! L’évaluation! La hiérarchie! Le respect des règles! Du pouvoir! Et puis, le «par cœur», ça tue l’innovation! L’initiative! C’est comme le travail à l’usine! Ça écrase! Ça étouffe! Laissons les enfants libres! L’important est qu’ils s’expriment! Ils vont inventer une nouvelle langue ! Des nouveaux mots ! Qui se retrouveront dans 25 ans dans le dictionnaire! «Vag»! «Wesh»! «Stife»! Comme disait un rappeur dans Le Devoir mardi, c’est le génie de la langue! Et c’est comme ça qu’un peuple meurt. Par paresse. Et indifférence. "
